{
  "schema_version": 2,
  "bundle_id": "yijie.desktop.skill-packages",
  "bundle_version": "0.5.1",
  "distribution_channel": "desktop-release",
  "source": {
    "repository": "https://github.com/36Dge/yijie-contracts.git",
    "revision_kind": "git-commit",
    "revision": "1111111111111111111111111111111111111111",
    "tree_sha256": "0d0e3a3047bfa9f5d5a518024ce41d5c429e109a608321a755ed503cea88e8f0"
  },
  "skills": [
    {
      "id": "yijie.sourcing-selection.aliexpress-supplier-evaluator",
      "runtime_name": "aliexpress-supplier-evaluator",
      "category": "sourcing-selection",
      "order": 0,
      "display_name": "AliExpress 供应商评估",
      "description": "合成目录 fixture：AliExpress 供应商评估；不包含观测源码或操作指令。",
      "version": "0.0.0",
      "catalog_entry_mode": "catalog-only",
      "icon": {
        "registry": "yj-icon-v1",
        "key": "skillSourcing"
      },
      "risk": {
        "level": "medium",
        "reasons": [
          "合成目录条目声明外部能力依赖，未连接或调用任何真实服务。"
        ]
      },
      "provenance": {
        "source_type": "third-party",
        "source_reference": "tests/fixtures/skills/catalog-v1/aliexpress-supplier-evaluator/SOURCE.txt",
        "source_version": "0.0.0",
        "source_sha256": "fef92b9ae29560b0c7a6186628537bbabb2363683ef15ff93a0c5f9885ad7e80",
        "review_status": "blocked",
        "reviewed_by": "FEAT-129 synthetic catalog owner",
        "reviewed_at": "2026-08-25T00:00:00Z"
      },
      "license": {
        "expression": "NOASSERTION",
        "redistribution_status": "blocked",
        "authorization_scope": "none",
        "evidence_reference": "tests/fixtures/skills/catalog-v1/aliexpress-supplier-evaluator/LICENSE-REVIEW.txt",
        "reviewed_by": "FEAT-129 synthetic catalog owner",
        "reviewed_at": "2026-08-25T00:00:00Z"
      },
      "capabilities": {
        "execution_mode": "tool-assisted",
        "network": "required",
        "filesystem": "none",
        "required_tools": [
          "browser.search",
          "supplier.data"
        ]
      },
      "release": {
        "catalog_status": "blocked",
        "maintenance_status": "maintained",
        "blocked_reason": "license_unverified"
      }
    },
    {
      "id": "yijie.sourcing-selection.dropshipping-supplier-integrator",
      "runtime_name": "dropshipping-supplier-integrator",
      "category": "sourcing-selection",
      "order": 1,
      "display_name": "代发货供应商集成",
      "description": "合成目录 fixture：代发货供应商集成；不包含观测源码或操作指令。",
      "version": "0.0.0",
      "catalog_entry_mode": "catalog-only",
      "icon": {
        "registry": "yj-icon-v1",
        "key": "skillSourcing"
      },
      "risk": {
        "level": "medium",
        "reasons": [
          "合成目录条目声明外部能力依赖，未连接或调用任何真实服务。"
        ]
      },
      "provenance": {
        "source_type": "third-party",
        "source_reference": "tests/fixtures/skills/catalog-v1/dropshipping-supplier-integrator/SOURCE.txt",
        "source_version": "0.0.0",
        "source_sha256": "10aac3e1e74e97dd24bc8f10af92526c2c73cc0dc83ee9ff583110617d02a82b",
        "review_status": "blocked",
        "reviewed_by": "FEAT-129 synthetic catalog owner",
        "reviewed_at": "2026-08-25T00:00:00Z"
      },
      "license": {
        "expression": "NOASSERTION",
        "redistribution_status": "blocked",
        "authorization_scope": "none",
        "evidence_reference": "tests/fixtures/skills/catalog-v1/dropshipping-supplier-integrator/LICENSE-REVIEW.txt",
        "reviewed_by": "FEAT-129 synthetic catalog owner",
        "reviewed_at": "2026-08-25T00:00:00Z"
      },
      "capabilities": {
        "execution_mode": "tool-assisted",
        "network": "required",
        "filesystem": "none",
        "required_tools": [
          "supplier.data",
          "store.write"
        ]
      },
      "release": {
        "catalog_status": "blocked",
        "maintenance_status": "maintained",
        "blocked_reason": "license_unverified"
      }
    },
    {
      "id": "yijie.sourcing-selection.product-supplier-sourcing",
      "runtime_name": "product-supplier-sourcing",
      "category": "sourcing-selection",
      "order": 2,
      "display_name": "产品供应商寻源",
      "description": "合成目录 fixture：产品供应商寻源；不包含观测源码或操作指令。",
      "version": "0.0.0",
      "catalog_entry_mode": "catalog-only",
      "icon": {
        "registry": "yj-icon-v1",
        "key": "skillSourcing"
      },
      "risk": {
        "level": "medium",
        "reasons": [
          "合成目录条目声明外部能力依赖，未连接或调用任何真实服务。"
        ]
      },
      "provenance": {
        "source_type": "third-party",
        "source_reference": "tests/fixtures/skills/catalog-v1/product-supplier-sourcing/SOURCE.txt",
        "source_version": "0.0.0",
        "source_sha256": "a1ca13aead1baad9633ecf6cb21ac885b24a73c9f897166565451c04dc0062a9",
        "review_status": "blocked",
        "reviewed_by": "FEAT-129 synthetic catalog owner",
        "reviewed_at": "2026-08-25T00:00:00Z"
      },
      "license": {
        "expression": "NOASSERTION",
        "redistribution_status": "blocked",
        "authorization_scope": "none",
        "evidence_reference": "tests/fixtures/skills/catalog-v1/product-supplier-sourcing/LICENSE-REVIEW.txt",
        "reviewed_by": "FEAT-129 synthetic catalog owner",
        "reviewed_at": "2026-08-25T00:00:00Z"
      },
      "capabilities": {
        "execution_mode": "tool-assisted",
        "network": "required",
        "filesystem": "none",
        "required_tools": [
          "browser.search",
          "supplier.data"
        ]
      },
      "release": {
        "catalog_status": "blocked",
        "maintenance_status": "maintained",
        "blocked_reason": "license_unverified"
      }
    },
    {
      "id": "yijie.sourcing-selection.sales-negotiator",
      "runtime_name": "sales-negotiator",
      "category": "sourcing-selection",
      "order": 3,
      "display_name": "销售谈判专家",
      "description": "合成目录 fixture：销售谈判专家；不包含观测源码或操作指令。",
      "version": "0.0.0",
      "catalog_entry_mode": "catalog-only",
      "icon": {
        "registry": "yj-icon-v1",
        "key": "skillSourcing"
      },
      "risk": {
        "level": "low",
        "reasons": [
          "合成目录条目不包含源码、归档或可执行指令。"
        ]
      },
      "provenance": {
        "source_type": "third-party",
        "source_reference": "tests/fixtures/skills/catalog-v1/sales-negotiator/SOURCE.txt",
        "source_version": "0.0.0",
        "source_sha256": "6b072891cc309e374e0570e3f0959db7ca05e91bd22c0063f26ecabe54117cfd",
        "review_status": "blocked",
        "reviewed_by": "FEAT-129 synthetic catalog owner",
        "reviewed_at": "2026-08-25T00:00:00Z"
      },
      "license": {
        "expression": "NOASSERTION",
        "redistribution_status": "blocked",
        "authorization_scope": "none",
        "evidence_reference": "tests/fixtures/skills/catalog-v1/sales-negotiator/LICENSE-REVIEW.txt",
        "reviewed_by": "FEAT-129 synthetic catalog owner",
        "reviewed_at": "2026-08-25T00:00:00Z"
      },
      "capabilities": {
        "execution_mode": "model-only",
        "network": "none",
        "filesystem": "none",
        "required_tools": []
      },
      "release": {
        "catalog_status": "blocked",
        "maintenance_status": "maintained",
        "blocked_reason": "license_unverified"
      }
    },
    {
      "id": "yijie.sourcing-selection.supplier-performance-manager",
      "runtime_name": "supplier-performance-manager",
      "category": "sourcing-selection",
      "order": 4,
      "display_name": "供应商绩效管理",
      "description": "合成目录 fixture：供应商绩效管理；不包含观测源码或操作指令。",
      "version": "0.0.0",
      "catalog_entry_mode": "catalog-only",
      "icon": {
        "registry": "yj-icon-v1",
        "key": "skillSourcing"
      },
      "risk": {
        "level": "medium",
        "reasons": [
          "合成目录条目声明外部能力依赖，未连接或调用任何真实服务。"
        ]
      },
      "provenance": {
        "source_type": "third-party",
        "source_reference": "tests/fixtures/skills/catalog-v1/supplier-performance-manager/SOURCE.txt",
        "source_version": "0.0.0",
        "source_sha256": "ec4abdd983ab69d36fd8edb4e0a0ca5f4e7542d2fb44937b94b8789c000bbb94",
        "review_status": "blocked",
        "reviewed_by": "FEAT-129 synthetic catalog owner",
        "reviewed_at": "2026-08-25T00:00:00Z"
      },
      "license": {
        "expression": "NOASSERTION",
        "redistribution_status": "blocked",
        "authorization_scope": "none",
        "evidence_reference": "tests/fixtures/skills/catalog-v1/supplier-performance-manager/LICENSE-REVIEW.txt",
        "reviewed_by": "FEAT-129 synthetic catalog owner",
        "reviewed_at": "2026-08-25T00:00:00Z"
      },
      "capabilities": {
        "execution_mode": "tool-assisted",
        "network": "required",
        "filesystem": "none",
        "required_tools": [
          "supplier.data"
        ]
      },
      "release": {
        "catalog_status": "blocked",
        "maintenance_status": "maintained",
        "blocked_reason": "license_unverified"
      }
    },
    {
      "id": "yijie.market-research.alibaba-amazon-market-intel",
      "runtime_name": "alibaba-amazon-market-intel",
      "category": "market-research",
      "order": 0,
      "display_name": "阿里巴巴与亚马逊市场洞察",
      "description": "合成目录 fixture：阿里巴巴与亚马逊市场洞察；不包含观测源码或操作指令。",
      "version": "0.0.0",
      "catalog_entry_mode": "catalog-only",
      "icon": {
        "registry": "yj-icon-v1",
        "key": "skillResearch"
      },
      "risk": {
        "level": "medium",
        "reasons": [
          "合成目录条目声明外部能力依赖，未连接或调用任何真实服务。"
        ]
      },
      "provenance": {
        "source_type": "third-party",
        "source_reference": "tests/fixtures/skills/catalog-v1/alibaba-amazon-market-intel/SOURCE.txt",
        "source_version": "0.0.0",
        "source_sha256": "ec2690378afe27d8a76a66ee720a7cdcda24c808b9b3136b3b59d68875fb356d",
        "review_status": "blocked",